{
  "$schema": "../../schema/frame.schema.json",
  "id": "title",
  "form": "bookend",
  "kind": "sovereign",
  "exemptFromChrome": true,
  "description": "Title bookend — claims the whole canvas with its own centred chrome, so the root masthead/footer Cells do not apply (design/forms.md §8/§9; FORM_TOGGLE_SKIP). A deck-opening cover slide.",
  "cells": ["stage"],
  "suppresses": ["masthead", "masthead-lede", "masthead-bay", "footer", "footer-left", "progress-centre", "pagination-right"]
}
