{
  "$schema": "../../schema/frame.schema.json",
  "id": "featured",
  "form": "panel",
  "kind": "sovereign",
  "exemptFromChrome": true,
  "description": "Full-bleed featured Frame — a prominent item plus supporting structure that claims the whole canvas, so the root chrome Cells do not apply (design/forms.md §8; FORM_TOGGLE_SKIP). Suppresses the masthead and footer.",
  "cells": ["stage"],
  "suppresses": ["masthead", "masthead-lede", "masthead-bay", "footer", "footer-left", "progress-centre", "pagination-right"]
}
