{
  "$schema": "../../schema/frame.schema.json",
  "id": "split-panel",
  "form": "split",
  "kind": "sovereign",
  "exemptFromChrome": true,
  "description": "Sovereign split panel — claims the whole canvas and re-carves it (the registry rewrites the h2 before masthead-lift would see it), so it reads as distinct from everything else (design/forms.md §8/§9; FORM_TOGGLE_SKIP). Suppresses the masthead and footer.",
  "cells": ["stage"],
  "suppresses": ["masthead", "masthead-lede", "masthead-bay", "footer", "footer-left", "progress-centre", "pagination-right"]
}
